[INFO] Scanning for projects...
[INFO] 
[INFO] ----------------------< com.mycompany:myproject >-----------------------
[INFO] Building myproject 1.0-SNAPSHOT
[INFO]   from pom.xml
[INFO] --------------------------------[ jar ]---------------------------------
[INFO] 
[INFO] --- clean:3.2.0:clean (default-clean) @ myproject ---
[INFO] Deleting C:\Users\javie\KarateGit\myproject\target
[INFO] 
[INFO] --- resources:3.3.1:resources (default-resources) @ myproject ---
[INFO] skip non existing resourceDirectory C:\Users\javie\KarateGit\myproject\src\main\resources
[INFO] 
[INFO] --- compiler:3.11.0:compile (default-compile) @ myproject ---
[INFO] No sources to compile
[INFO] 
[INFO] --- resources:3.3.1:testResources (default-testResources) @ myproject ---
[INFO] Copying 4 resources from src\test\java to target\test-classes
[INFO] 
[INFO] --- compiler:3.11.0:testCompile (default-testCompile) @ myproject ---
[INFO] Changes detected - recompiling the module! :source
[INFO] Compiling 1 source file with javac [debug target 11] to target\test-classes
[WARNING] system modules path not set in conjunction with -source 11
[INFO] 
[INFO] --- surefire:3.0.0:test (default-test) @ myproject ---
[INFO] Using auto detected provider org.apache.maven.surefire.junitplatform.JUnitPlatformProvider
[INFO] 
[INFO] -------------------------------------------------------
[INFO]  T E S T S
[INFO] -------------------------------------------------------
[INFO] Running conduitApp.ConduitTest
23:32:17.240 [main] DEBUG com.intuit.karate.Suite - [config] classpath:karate-config.js
23:32:17.252 [main] DEBUG com.intuit.karate.Suite - waiting for 2 features to complete
23:32:18.916 [pool-2-thread-2] INFO  com.intuit.karate - karate.env system property was: null 
23:32:18.916 [pool-2-thread-3] INFO  com.intuit.karate - karate.env system property was: null 
23:32:18.916 [pool-2-thread-1] INFO  com.intuit.karate - karate.env system property was: null 
23:32:19.372 [pool-2-thread-2] DEBUG com.intuit.karate - request:
1 > GET https://api.realworld.io/api/tags
1 > Host: api.realworld.io
1 > Connection: Keep-Alive
1 > User-Agent: Apache-HttpClient/4.5.14 (Java/15.0.2)
1 > Accept-Encoding: gzip,deflate


23:32:19.372 [pool-2-thread-3] DEBUG com.intuit.karate - request:
1 > GET https://api.realworld.io/api/articles?offset=0&limit=10
1 > Host: api.realworld.io
1 > Connection: Keep-Alive
1 > User-Agent: Apache-HttpClient/4.5.14 (Java/15.0.2)
1 > Accept-Encoding: gzip,deflate


23:32:19.373 [pool-2-thread-1] DEBUG com.intuit.karate - request:
1 > POST https://api.realworld.io/api/users/login
1 > Content-Type: application/json; charset=UTF-8
1 > Content-Length: 67
1 > Host: api.realworld.io
1 > Connection: Keep-Alive
1 > User-Agent: Apache-HttpClient/4.5.14 (Java/15.0.2)
1 > Accept-Encoding: gzip,deflate
{"user":{"email":"javierkarate1@test.com","password":"karate1234"}}

23:32:20.237 [pool-2-thread-1] DEBUG com.intuit.karate - response time in milliseconds: 860
1 < 200
1 < Date: Fri, 15 Dec 2023 02:32:19 GMT
1 < Content-Type: application/json; charset=utf-8
1 < Transfer-Encoding: chunked
1 < Connection: keep-alive
1 < Report-To: {"group":"heroku-nel","max_age":3600,"endpoints":[{"url":"https://nel.heroku.com/reports?ts=1702607539&sid=c46efe9b-d3d2-4a0c-8c76-bfafa16c5add&s=CF6XFd1Tzrb9SmOXi6U6e5Vx0Xm5mQMM08NnpgV%2FzFc%3D"}]}
1 < Reporting-Endpoints: heroku-nel=https://nel.heroku.com/reports?ts=1702607539&sid=c46efe9b-d3d2-4a0c-8c76-bfafa16c5add&s=CF6XFd1Tzrb9SmOXi6U6e5Vx0Xm5mQMM08NnpgV%2FzFc%3D
1 < Nel: {"report_to":"heroku-nel","max_age":3600,"success_fraction":0.005,"failure_fraction":0.05,"response_headers":["Via"]}
1 < X-Powered-By: Express
1 < Access-Control-Allow-Origin: *
1 < Etag: W/"179-4rRBoIK8Xx5jIPEOimoM+C96c8g"
1 < Via: 1.1 vegur
1 < CF-Cache-Status: DYNAMIC
1 < Server: cloudflare
1 < CF-RAY: 835b46814d4b1d5e-GIG
1 < alt-svc: h3=":443"; ma=86400
{"user":{"email":"javierkarate1@test.com","username":"javier karate 1","bio":null,"image":"https://api.realworld.io/images/smiley-cyrus.jpeg","token":"eyJhbGciOiJIUzI1NiIsInR5cCI6IkpXVCJ9.eyJ1c2VyIjp7ImVtYWlsIjoiamF2aWVya2FyYXRlMUB0ZXN0LmNvbSIsInVzZXJuYW1lIjoiamF2aWVyIGthcmF0ZSAxIn0sImlhdCI6MTcwMjYwNzUzOSwiZXhwIjoxNzA3NzkxNTM5fQ.ReA8_Wxg6zAVx3iPN_REPYAFtT9Oq9bIrCfez4pL9qc"}}

23:32:20.256 [pool-2-thread-1] DEBUG com.intuit.karate - request:
2 > POST https://api.realworld.io/api/articles
2 > Authorization: Token eyJhbGciOiJIUzI1NiIsInR5cCI6IkpXVCJ9.eyJ1c2VyIjp7ImVtYWlsIjoiamF2aWVya2FyYXRlMUB0ZXN0LmNvbSIsInVzZXJuYW1lIjoiamF2aWVyIGthcmF0ZSAxIn0sImlhdCI6MTcwMjYwNzUzOSwiZXhwIjoxNzA3NzkxNTM5fQ.ReA8_Wxg6zAVx3iPN_REPYAFtT9Oq9bIrCfez4pL9qc
2 > Content-Type: application/json; charset=UTF-8
2 > Content-Length: 114
2 > Host: api.realworld.io
2 > Connection: Keep-Alive
2 > User-Agent: Apache-HttpClient/4.5.14 (Java/15.0.2)
2 > Accept-Encoding: gzip,deflate
{"article":{"tagList":[],"title":"Articun4","description":"Its about  articuno1","body":"Articuno is a pokemon1"}}

23:32:20.743 [pool-2-thread-1] DEBUG com.intuit.karate - response time in milliseconds: 486
2 < 422
2 < Date: Fri, 15 Dec 2023 02:32:20 GMT
2 < Content-Type: application/json; charset=utf-8
2 < Content-Length: 39
2 < Connection: keep-alive
2 < Report-To: {"group":"heroku-nel","max_age":3600,"endpoints":[{"url":"https://nel.heroku.com/reports?ts=1702607540&sid=c46efe9b-d3d2-4a0c-8c76-bfafa16c5add&s=UBMyBNawSpVrbekFebMTmWvOWpKiKVtzRfgGJ1hEqgI%3D"}]}
2 < Reporting-Endpoints: heroku-nel=https://nel.heroku.com/reports?ts=1702607540&sid=c46efe9b-d3d2-4a0c-8c76-bfafa16c5add&s=UBMyBNawSpVrbekFebMTmWvOWpKiKVtzRfgGJ1hEqgI%3D
2 < Nel: {"report_to":"heroku-nel","max_age":3600,"success_fraction":0.005,"failure_fraction":0.05,"response_headers":["Via"]}
2 < X-Powered-By: Express
2 < Access-Control-Allow-Origin: *
2 < Etag: W/"27-BNeuaWQ7DHvW/r+pl+qdJiF06Is"
2 < Via: 1.1 vegur
2 < CF-Cache-Status: DYNAMIC
2 < Server: cloudflare
2 < CF-RAY: 835b46850a8064c7-GIG
2 < alt-svc: h3=":443"; ma=86400
{"errors":{"title":["must be unique"]}}

23:32:20.752 [pool-2-thread-1] ERROR com.intuit.karate - classpath:conduitApp/feature/Articles.feature:18
Then status 201
status code was: 422, expected: 201, response time in milliseconds: 486, url: https://api.realworld.io/api/articles, response: 
{"errors":{"title":["must be unique"]}}
classpath:conduitApp/feature/Articles.feature:18
23:32:20.799 [pool-2-thread-2] DEBUG com.intuit.karate - response time in milliseconds: 1425
1 < 200
1 < Date: Fri, 15 Dec 2023 02:32:20 GMT
1 < Content-Type: application/json; charset=utf-8
1 < Transfer-Encoding: chunked
1 < Connection: keep-alive
1 < Report-To: {"group":"heroku-nel","max_age":3600,"endpoints":[{"url":"https://nel.heroku.com/reports?ts=1702607539&sid=c46efe9b-d3d2-4a0c-8c76-bfafa16c5add&s=CF6XFd1Tzrb9SmOXi6U6e5Vx0Xm5mQMM08NnpgV%2FzFc%3D"}]}
1 < Reporting-Endpoints: heroku-nel=https://nel.heroku.com/reports?ts=1702607539&sid=c46efe9b-d3d2-4a0c-8c76-bfafa16c5add&s=CF6XFd1Tzrb9SmOXi6U6e5Vx0Xm5mQMM08NnpgV%2FzFc%3D
1 < Nel: {"report_to":"heroku-nel","max_age":3600,"success_fraction":0.005,"failure_fraction":0.05,"response_headers":["Via"]}
1 < X-Powered-By: Express
1 < Access-Control-Allow-Origin: *
1 < Etag: W/"76-Frx7q70rrmrTv50MB4MX2rP8Pic"
1 < Via: 1.1 vegur
1 < CF-Cache-Status: DYNAMIC
1 < Server: cloudflare
1 < CF-RAY: 835b46814d6925f1-GIG
1 < alt-svc: h3=":443"; ma=86400
{"tags":["welcome","implementations","introduction","codebaseShow","ipsum","et","cupiditate","qui","quia","deserunt"]}

23:32:21.297 [pool-2-thread-3] DEBUG com.intuit.karate - response time in milliseconds: 1921
1 < 200
1 < Date: Fri, 15 Dec 2023 02:32:20 GMT
1 < Content-Type: application/json; charset=utf-8
1 < Transfer-Encoding: chunked
1 < Connection: keep-alive
1 < Report-To: {"group":"heroku-nel","max_age":3600,"endpoints":[{"url":"https://nel.heroku.com/reports?ts=1702607539&sid=c46efe9b-d3d2-4a0c-8c76-bfafa16c5add&s=CF6XFd1Tzrb9SmOXi6U6e5Vx0Xm5mQMM08NnpgV%2FzFc%3D"}]}
1 < Reporting-Endpoints: heroku-nel=https://nel.heroku.com/reports?ts=1702607539&sid=c46efe9b-d3d2-4a0c-8c76-bfafa16c5add&s=CF6XFd1Tzrb9SmOXi6U6e5Vx0Xm5mQMM08NnpgV%2FzFc%3D
1 < Nel: {"report_to":"heroku-nel","max_age":3600,"success_fraction":0.005,"failure_fraction":0.05,"response_headers":["Via"]}
1 < X-Powered-By: Express
1 < Access-Control-Allow-Origin: *
1 < Etag: W/"55fb-Zo1cVTWMuCDbOSD7VQJ3aNMvllA"
1 < Via: 1.1 vegur
1 < CF-Cache-Status: DYNAMIC
1 < Server: cloudflare
1 < CF-RAY: 835b46814a8c64c3-GIG
1 < alt-svc: h3=":443"; ma=86400
{"articles":[{"slug":"If-we-quantify-the-alarm-we-can-get-to-the-FTP-pixel-through-the-online-SSL-interface!-120863","title":"If we quantify the alarm, we can get to the FTP pixel through the online SSL interface!","description":"Omnis perspiciatis qui quia commodi sequi modi. Nostrum quam aut cupiditate est facere omnis possimus. Tenetur similique nemo illo soluta molestias facere quo. Ipsam totam facilis delectus nihil quidem soluta vel est omnis.","body":"Quia quo iste et aperiam voluptas consectetur a omnis et.\\nDolores et earum consequuntur sunt et.\\nEa nulla ab voluptatem dicta vel. Temporibus aut adipisci magnam aliquam eveniet nihil laudantium reprehenderit sit.\\nAspernatur cumque labore voluptates mollitia deleniti et. Quos pariatur tenetur.\\nQuasi omnis eveniet eos maiores esse magni possimus blanditiis.\\nQui incidunt sit quos consequatur aut qui et aperiam delectus.\\nPraesentium quas culpa.\\nEaque occaecati cumque incidunt et. Provident saepe omnis non molestiae natus et.\\nAccusamus laudantium hic unde voluptate et sunt voluptatem.\\nMollitia velit id eius mollitia occaecati repudiandae. Voluptatum tempora voluptas est odio iure odio dolorem.\\nVoluptatum est deleniti explicabo explicabo harum provident quis molestiae. Sed dolores nostrum quis. Aut ipsa et qui vel similique sed hic a.\\nVoluptates dolorem culpa nihil aut ipsam voluptatem. Cupiditate officia voluptatum.\\nTenetur facere eum distinctio animi qui laboriosam.\\nQuod sed voluptatem et cumque est eos.\\nSint id provident suscipit harum odio et. Facere beatae delectus ut.\\nPossimus voluptas perspiciatis voluptatem nihil sint praesentium.\\nSint est nihil voluptates nesciunt voluptatibus temporibus blanditiis.\\nOfficiis voluptatem earum sed. Deserunt ab porro similique est accusamus id enim aut suscipit.\\nSoluta reprehenderit error nesciunt odit veniam sed.\\nDolore optio qui aut ab.\\nAut minima provident eius repudiandae a quibusdam in nisi quam.","tagList":["rerum","maiores","omnis","quae"],"createdAt":"2022-12-09T13:46:24.264Z","updatedAt":"2022-12-09T13:46:24.264Z","favorited":false,"favoritesCount":2309,"author":{"username":"Anah Benešová","bio":null,"image":"https://api.realworld.io/images/demo-avatar.png","following":false}},{"slug":"Try-to-transmit-the-HTTP-card-maybe-it-will-override-the-multi-byte-hard-drive!-120863","title":"Try to transmit the HTTP card, maybe it will override the multi-byte hard drive!","description":"Assumenda molestiae laboriosam enim ipsum quaerat enim officia vel quo. Earum odit rem natus totam atque cumque. Sint dolorem facere non.","body":"Sunt excepturi ut dolore fuga.\\nAutem eum maiores aut nihil magnam corporis consectetur sit. Voluptate et quasi optio eos et eveniet culpa et nobis.\\nSint aut sint sequi possimus reiciendis nisi.\\nRerum et omnis et sit doloribus corporis voluptas error.\\nIusto molestiae tenetur necessitatibus dolorem omnis. Libero sed ut architecto.\\nEx itaque et modi aut voluptatem alias quae.\\nModi dolor cupiditate sit.\\nDelectus consectetur nobis aliquid deserunt sint ut et voluptas.\\nCorrupti in labore laborum quod. Ipsa laudantium deserunt. Ut atque harum inventore natus facere sed molestiae.\\nQuia aliquid ut.\\nAnimi sunt rem et sit ullam dolorem ab consequatur modi. Cupiditate officia voluptatum.\\nTenetur facere eum distinctio animi qui laboriosam.\\nQuod sed voluptatem et cumque est eos.\\nSint id provident suscipit harum odio et. Et fuga repellendus magnam dignissimos eius aspernatur rerum. Quo perferendis nesciunt.\\nDolore dolorem porro omnis voluptatibus consequuntur et expedita suscipit et.\\nTempora facere ipsa.\\nDolore accusamus soluta officiis eligendi.\\nEum quaerat neque eum beatae odio. Ad voluptate vel.\\nAut aut dolor. Cupiditate officia voluptatum.\\nTenetur facere eum distinctio animi qui laboriosam.\\nQuod sed voluptatem et cumque est eos.\\nSint id provident suscipit harum odio et.","tagList":["voluptate","rerum","ducimus","hic"],"createdAt":"2022-12-09T13:46:24.264Z","updatedAt":"2022-12-09T13:46:24.264Z","favorited":false,"favoritesCount":2291,"author":{"username":"Anah Benešová","bio":null,"image":"https://api.realworld.io/images/demo-avatar.png","following":false}},{"slug":"Try-to-generate-the-TCP-bus-maybe-it-will-override-the-neural-bandwidth!-120863","title":"Try to generate the TCP bus, maybe it will override the neural bandwidth!","description":"Pariatur ut dolor repellendus dolores ut debitis. Est iusto neque dicta voluptatibus quia nulla consequatur. Omnis aut sed dolores qui laborum a amet.","body":"Quo perferendis nesciunt.\\nDolore dolorem porro omnis voluptatibus consequuntur et expedita suscipit et.\\nTempora facere ipsa.\\nDolore accusamus soluta officiis eligendi.\\nEum quaerat neque eum beatae odio. Qui soluta veritatis autem repellat et inventore occaecati. Doloribus consequatur et labore suscipit deserunt tempore ad quasi sed.\\nQuam cupiditate modi dolor et eos et culpa qui.\\nDelectus molestias ea id.\\nIllum ea unde sapiente non non non.\\nDolorem ut sed magni. Provident saepe omnis non molestiae natus et.\\nAccusamus laudantium hic unde voluptate et sunt voluptatem.\\nMollitia velit id eius mollitia occaecati repudiandae. Incidunt doloremque enim autem quam et magnam et expedita fuga.\\nPlaceat quia dolor ut.\\nNon dolor amet temporibus quas non hic sed.\\nQui tempore enim mollitia omnis sed ut eos rerum et.\\nQuidem voluptas est vel. Placeat sequi quaerat sapiente aspernatur autem sunt molestiae voluptatem.\\nAccusamus unde libero accusamus omnis totam et temporibus. Cupiditate officia voluptatum.\\nTenetur facere eum distinctio animi qui laboriosam.\\nQuod sed voluptatem et cumque est eos.\\nSint id provident suscipit harum odio et. Iusto laborum aperiam neque delectus consequuntur provident est maiores explicabo. Laborum est maxime enim accusantium magnam.\\nRerum dolorum minus laudantium delectus eligendi necessitatibus quia.\\nDeleniti consequatur explicabo aut nobis est vero tempore.\\nExcepturi earum quo quod voluptatem quo iure vel sapiente occaecati.\\nConsectetur consequatur corporis doloribus omnis harum voluptas esse amet. Mollitia nostrum exercitationem sunt rem.\\nRem et voluptas consequatur mollitia nostrum.\\nSunt nesciunt et pariatur quam provident impedit.","tagList":["dicta","rerum","omnis","blanditiis"],"createdAt":"2022-12-09T13:46:24.263Z","updatedAt":"2022-12-09T13:46:24.263Z","favorited":false,"favoritesCount":448,"author":{"username":"Anah Benešová","bio":null,"image":"https://api.realworld.io/images/demo-avatar.png","following":false}},{"slug":"You-cant-transmit-the-firewall-without-copying-the-1080p-SDD-interface!-120863","title":"You cant transmit the firewall without copying the 1080p SDD interface!","description":"Est sed deserunt eligendi in velit saepe. Dolorem quis illo vero qui ut recusandae occaecati dolores quae. Voluptatem vero aliquam alias adipisci reiciendis odit nobis est. Vel laboriosam quia commodi rerum. Voluptatum et sed et nesciunt iure ipsum iste aut enim.","body":"Incidunt doloremque enim autem quam et magnam et expedita fuga.\\nPlaceat quia dolor ut.\\nNon dolor amet temporibus quas non hic sed.\\nQui tempore enim mollitia omnis sed ut eos rerum et.\\nQuidem voluptas est vel. Temporibus quod quidem placeat porro.\\nUnde ipsam vel explicabo. Qui et dolorum.\\nEveniet architecto qui accusamus et modi harum facilis a eum.\\nEt vel cumque voluptatem earum minima perferendis. Ducimus dolores recusandae.\\nEa aut aperiam et aut eos inventore.\\nQuia cum ducimus autem iste.\\nQuos consequuntur est delectus temporibus autem. Quas ea voluptatem iste iure.\\nEt soluta et doloremque vero quis occaecati et fuga.\\nIncidunt recusandae dignissimos iusto quisquam sed unde at ea incidunt.\\nId voluptate incidunt qui totam autem voluptas maxime atque quaerat.\\nCorporis iste ut molestiae. Laborum itaque quos provident.\\nRerum cupiditate praesentium amet voluptatem dolor impedit modi dicta.\\nVoluptates assumenda optio est.\\nNon aperiam nam consequuntur vel a commodi dicta incidunt. Autem reiciendis provident iure possimus.\\nOccaecati soluta quibusdam libero tenetur minus vel sit illo.\\nCulpa optio dolorem eos similique voluptatem voluptatibus error accusantium. Officia consectetur quibusdam velit debitis porro quia cumque.\\nSuscipit esse voluptatem cum sit totam consequatur molestiae est.\\nMollitia pariatur distinctio fugit. Quis nesciunt ut est eos.\\nQui reiciendis doloribus.\\nEst quidem ullam reprehenderit.\\nEst omnis eligendi quis quis quo eum officiis asperiores quis. Et sed dicta eveniet accusamus consequatur.\\nUllam voluptas consequatur aut eos ducimus.\\nId officia est ut dicta provident beatae ipsa.","tagList":["possimus","maiores","facilis"],"createdAt":"2022-12-09T13:46:24.263Z","updatedAt":"2022-12-09T13:46:24.263Z","favorited":false,"favoritesCount":299,"author":{"username":"Anah Benešová","bio":null,"image":"https://api.realworld.io/images/demo-avatar.png","following":false}},{"slug":"You-cant-connect-the-interface-without-programming-the-virtual-PNG-protocol!-120863","title":"You cant connect the interface without programming the virtual PNG protocol!","description":"Vel facere dolorem sit hic non. Veniam nihil cumque sed et delectus. Maiores minus quisquam nostrum. Eius quasi nostrum. Molestiae recusandae ut. Suscipit natus aliquam eos sit aut.","body":"Cupiditate officia voluptatum.\\nTenetur facere eum distinctio animi qui laboriosam.\\nQuod sed voluptatem et cumque est eos.\\nSint id provident suscipit harum odio et. Commodi est rerum dolorum quae voluptatem aliquam. Ad voluptate vel.\\nAut aut dolor. Iusto laborum aperiam neque delectus consequuntur provident est maiores explicabo. Voluptatum tempora voluptas est odio iure odio dolorem.\\nVoluptatum est deleniti explicabo explicabo harum provident quis molestiae. Commodi est rerum dolorum quae voluptatem aliquam. Doloribus temporibus dolorum placeat.\\nFugit nulla quaerat.\\nEveniet ratione odit sed non rerum.\\nNemo tempore eveniet veritatis alias repellat et.\\nVoluptas nisi quis commodi id. Provident saepe omnis non molestiae natus et.\\nAccusamus laudantium hic unde voluptate et sunt voluptatem.\\nMollitia velit id eius mollitia occaecati repudiandae. Ipsa cumque ad repellat qui libero quia impedit fugiat.\\nExcepturi ut vitae recusandae eos quisquam et voluptatem.\\nNeque nostrum distinctio provident eius tempore odio aliquid.\\nSaepe ut suscipit architecto. Molestias non debitis quibusdam quis quod.\\nSaepe ab et hic unde et sed.\\nMagni voluptatem est.\\nEt similique quo porro et.","tagList":["dicta","repellat","facilis","labore"],"createdAt":"2022-12-09T13:46:24.263Z","updatedAt":"2022-12-09T13:46:24.263Z","favorited":false,"favoritesCount":281,"author":{"username":"Anah Benešová","bio":null,"image":"https://api.realworld.io/images/demo-avatar.png","following":false}},{"slug":"Try-to-bypass-the-SAS-card-maybe-it-will-transmit-the-solid-state-system!-120863","title":"Try to bypass the SAS card, maybe it will transmit the solid state system!","description":"Est iste totam accusamus dolorem est. Quis non sit impedit similique incidunt odio aspernatur aut rem. Architecto est eum.","body":"Ipsa cumque ad repellat qui libero quia impedit fugiat.\\nExcepturi ut vitae recusandae eos quisquam et voluptatem.\\nNeque nostrum distinctio provident eius tempore odio aliquid.\\nSaepe ut suscipit architecto. Sapiente vitae culpa ut voluptatem incidunt excepturi voluptates exercitationem.\\nSed doloribus alias consectetur omnis occaecati ad placeat labore.\\nVoluptate consequatur expedita nemo recusandae sint assumenda.\\nQui vel totam quia fugit saepe suscipit autem quasi qui.\\nEt eum vel ut delectus ut nesciunt animi. Mollitia nostrum exercitationem sunt rem.\\nRem et voluptas consequatur mollitia nostrum.\\nSunt nesciunt et pariatur quam provident impedit. Officia consectetur quibusdam velit debitis porro quia cumque.\\nSuscipit esse voluptatem cum sit totam consequatur molestiae est.\\nMollitia pariatur distinctio fugit. Qui et dolorum.\\nEveniet architecto qui accusamus et modi harum facilis a eum.\\nEt vel cumque voluptatem earum minima perferendis. Illum voluptates ut vel et.\\nUt debitis excepturi suscipit perferendis officia numquam possimus.\\nFacere sit doloremque repudiandae corrupti veniam qui. Ipsa laudantium deserunt. Totam ab necessitatibus quidem non. Mollitia nostrum exercitationem sunt rem.\\nRem et voluptas consequatur mollitia nostrum.\\nSunt nesciunt et pariatur quam provident impedit. Molestias non debitis quibusdam quis quod.\\nSaepe ab et hic unde et sed.\\nMagni voluptatem est.\\nEt similique quo porro et.","tagList":["dolores","aut","consectetur","ullam"],"createdAt":"2022-12-09T13:46:24.263Z","updatedAt":"2022-12-09T13:46:24.263Z","favorited":false,"favoritesCount":401,"author":{"username":"Anah Benešová","bio":null,"image":"https://api.realworld.io/images/demo-avatar.png","following":false}},{"slug":"Use-the-auxiliary-EXE-monitor-then-you-can-hack-the-haptic-port!-120863","title":"Use the auxiliary EXE monitor, then you can hack the haptic port!","description":"Et id harum unde et ratione minima non. Suscipit ipsum rem. Sed asperiores quaerat dolorum autem nihil voluptatem et hic ut. Molestiae rerum autem. Dolores nam soluta officia pariatur debitis.","body":"Est est sed itaque necessitatibus vitae officiis.\\nIusto dolores sint eveniet quasi dolore quo laborum esse laboriosam.\\nModi similique aut voluptates animi aut dicta dolorum.\\nSint explicabo autem quidem et.\\nNeque aspernatur assumenda fugit provident. Aut ipsa et qui vel similique sed hic a.\\nVoluptates dolorem culpa nihil aut ipsam voluptatem. Dolores accusamus ducimus suscipit neque fugit quo aliquam.\\nOdit eum eum sint accusamus.\\nQuod ipsum sed placeat.\\nEt culpa voluptas et quod atque a.\\nVoluptatibus rerum nihil quia cupiditate nihil facere beatae dolor. Fugit harum mollitia.\\nMagni eos asperiores assumenda ad. Id est non ad temporibus nobis.\\nQuod soluta quae voluptatem quisquam est. Quas ea voluptatem iste iure.\\nEt soluta et doloremque vero quis occaecati et fuga.\\nIncidunt recusandae dignissimos iusto quisquam sed unde at ea incidunt.\\nId voluptate incidunt qui totam autem voluptas maxime atque quaerat.\\nCorporis iste ut molestiae. Illum voluptates ut vel et.\\nUt debitis excepturi suscipit perferendis officia numquam possimus.\\nFacere sit doloremque repudiandae corrupti veniam qui. Sunt excepturi ut dolore fuga.\\nAutem eum maiores aut nihil magnam corporis consectetur sit. Laborum itaque quos provident.\\nRerum cupiditate praesentium amet voluptatem dolor impedit modi dicta.\\nVoluptates assumenda optio est.\\nNon aperiam nam consequuntur vel a commodi dicta incidunt. Quia consequatur voluptatibus et.\\nVoluptatibus aspernatur et.\\nDicta architecto qui dignissimos.\\nVeritatis facilis voluptatem inventore aliquid cum.\\nNumquam odio quis porro sunt adipisci culpa.","tagList":["necessitatibus","vitae","repellat","labore"],"createdAt":"2022-12-09T13:46:24.263Z","updatedAt":"2022-12-09T13:46:24.263Z","favorited":false,"favoritesCount":271,"author":{"username":"Anah Benešová","bio":null,"image":"https://api.realworld.io/images/demo-avatar.png","following":false}},{"slug":"quantifying-the-microchip-wont-do-anything-we-need-to-index-the-online-SQL-hard-drive!-120863","title":"quantifying the microchip wont do anything, we need to index the online SQL hard drive!","description":"Minima soluta sed sed et optio explicabo at distinctio repudiandae. Magnam deleniti a ea. Non velit accusamus veniam qui. Necessitatibus velit ad aut officiis in officiis quasi. Sunt nulla dolores voluptatem esse magnam ut.","body":"Ab rerum eos ipsa accusantium nihil voluptatem.\\nEum minus alias.\\nIure commodi at harum.\\nNostrum non occaecati omnis quisquam. Id est non ad temporibus nobis.\\nQuod soluta quae voluptatem quisquam est. Quos pariatur tenetur.\\nQuasi omnis eveniet eos maiores esse magni possimus blanditiis.\\nQui incidunt sit quos consequatur aut qui et aperiam delectus.\\nPraesentium quas culpa.\\nEaque occaecati cumque incidunt et. Sunt excepturi ut dolore fuga.\\nAutem eum maiores aut nihil magnam corporis consectetur sit. Ipsa cumque ad repellat qui libero quia impedit fugiat.\\nExcepturi ut vitae recusandae eos quisquam et voluptatem.\\nNeque nostrum distinctio provident eius tempore odio aliquid.\\nSaepe ut suscipit architecto. Cum vitae aliquam neque consequatur quia id dicta ipsam.\\nExercitationem ab eum exercitationem non alias numquam qui.\\nItaque rerum ut nobis est nam vitae exercitationem minima fugiat.\\nEst sit non tempora soluta consequatur eveniet.\\nCorporis nisi dolorem architecto voluptatem. Quos pariatur tenetur.\\nQuasi omnis eveniet eos maiores esse magni possimus blanditiis.\\nQui incidunt sit quos consequatur aut qui et aperiam delectus.\\nPraesentium quas culpa.\\nEaque occaecati cumque incidunt et. Illum voluptates ut vel et.\\nUt debitis excepturi suscipit perferendis officia numquam possimus.\\nFacere sit doloremque repudiandae corrupti veniam qui. Ab quis aut earum.\\nVoluptatem sint accusantium sed cupiditate optio.\\nConsequatur in dolores aut enim.\\nNon sunt atque maxime dolores.\\nNam impedit sit. Est est sed itaque necessitatibus vitae officiis.\\nIusto dolores sint eveniet quasi dolore quo laborum esse laboriosam.\\nModi similique aut voluptates animi aut dicta dolorum.\\nSint explicabo autem quidem et.\\nNeque aspernatur assumenda fugit provident.","tagList":["possimus","voluptatem","cupiditate"],"createdAt":"2022-12-09T13:46:24.263Z","updatedAt":"2022-12-09T13:46:24.263Z","favorited":false,"favoritesCount":606,"author":{"username":"Anah Benešová","bio":null,"image":"https://api.realworld.io/images/demo-avatar.png","following":false}},{"slug":"We-need-to-calculate-the-bluetooth-JBOD-bus!-120863","title":"We need to calculate the bluetooth JBOD bus!","description":"Ipsa nemo eos sequi nulla id accusamus nam ratione dolore. Omnis sint quisquam accusamus rem rem nihil. Non minus animi cum dolorem earum odit sequi. Rem non inventore sed dicta atque modi. Sed dolorem iste molestiae. Sed eum iste aliquid aliquid.","body":"Nisi vitae nostrum perspiciatis impedit laborum repellat ullam et ut. Qui soluta veritatis autem repellat et inventore occaecati. Reprehenderit quae quas quos sapiente ullam ut.\\nVoluptates non ut. Iusto laborum aperiam neque delectus consequuntur provident est maiores explicabo. Quia harum nulla et quos sint voluptates exercitationem corrupti. Quis nesciunt ut est eos.\\nQui reiciendis doloribus.\\nEst quidem ullam reprehenderit.\\nEst omnis eligendi quis quis quo eum officiis asperiores quis. Ipsa cumque ad repellat qui libero quia impedit fugiat.\\nExcepturi ut vitae recusandae eos quisquam et voluptatem.\\nNeque nostrum distinctio provident eius tempore odio aliquid.\\nSaepe ut suscipit architecto. Eveniet sit ipsa officiis laborum.\\nIn vel est omnis sed impedit quod magni.\\nDignissimos quis illum qui atque aut ut quasi sequi. Ab quis aut earum.\\nVoluptatem sint accusantium sed cupiditate optio.\\nConsequatur in dolores aut enim.\\nNon sunt atque maxime dolores.\\nNam impedit sit. Nemo tempore dolor maiores blanditiis quia qui qui voluptatem non.\\nNisi dolores animi laboriosam aliquam qui adipisci voluptates atque dignissimos.\\nLibero sit quibusdam corporis aut inventore natus libero.\\nPraesentium omnis dolorum temporibus repellendus qui.\\nNon nostrum doloribus occaecati dolores sit ut.","tagList":["nostrum","quia","quaerat","numquam"],"createdAt":"2022-12-09T13:46:24.263Z","updatedAt":"2022-12-09T13:46:24.263Z","favorited":false,"favoritesCount":340,"author":{"username":"Anah Benešová","bio":null,"image":"https://api.realworld.io/images/demo-avatar.png","following":false}},{"slug":"We-need-to-bypass-the-redundant-RAM-pixel!-120863","title":"We need to bypass the redundant RAM pixel!","description":"Eveniet qui aperiam et. Rem incidunt sapiente architecto earum consectetur officia. Assumenda voluptatem sed aperiam sed temporibus sunt in. Totam molestiae aspernatur quia non rem facilis expedita harum veritatis. Culpa ipsam quo dolor.","body":"Ducimus dolores recusandae.\\nEa aut aperiam et aut eos inventore.\\nQuia cum ducimus autem iste.\\nQuos consequuntur est delectus temporibus autem. Et sed dicta eveniet accusamus consequatur.\\nUllam voluptas consequatur aut eos ducimus.\\nId officia est ut dicta provident beatae ipsa. Est est sed itaque necessitatibus vitae officiis.\\nIusto dolores sint eveniet quasi dolore quo laborum esse laboriosam.\\nModi similique aut voluptates animi aut dicta dolorum.\\nSint explicabo autem quidem et.\\nNeque aspernatur assumenda fugit provident. Ab rerum eos ipsa accusantium nihil voluptatem.\\nEum minus alias.\\nIure commodi at harum.\\nNostrum non occaecati omnis quisquam. Ut atque harum inventore natus facere sed molestiae.\\nQuia aliquid ut.\\nAnimi sunt rem et sit ullam dolorem ab consequatur modi. In ipsam mollitia placeat quia adipisci rerum labore repellat. Ad voluptate vel.\\nAut aut dolor. Quas ea voluptatem iste iure.\\nEt soluta et doloremque vero quis occaecati et fuga.\\nIncidunt recusandae dignissimos iusto quisquam sed unde at ea incidunt.\\nId voluptate incidunt qui totam autem voluptas maxime atque quaerat.\\nCorporis iste ut molestiae. Deleniti explicabo assumenda ipsum cumque voluptatem blanditiis voluptatum omnis provident.\\nQuis placeat nisi fugit aperiam quaerat mollitia.\\nOccaecati repellendus voluptate similique.\\nLaboriosam qui qui voluptas itaque ipsa. Est aut quis soluta accusantium debitis vel.\\nQuisquam aliquid ex corporis velit.","tagList":["necessitatibus","excepturi","sed","nulla"],"createdAt":"2022-12-09T13:46:24.262Z","updatedAt":"2022-12-09T13:46:24.262Z","favorited":false,"favoritesCount":53,"author":{"username":"Anah Benešová","bio":null,"image":"https://api.realworld.io/images/demo-avatar.png","following":false}}],"articlesCount":197}

---------------------------------------------------------
feature: classpath:conduitApp/feature/Articles.feature
scenarios:  1 | passed:  0 | failed:  1 | time: 1,7727
---------------------------------------------------------

23:32:21.558 [pool-3-thread-1] INFO  com.intuit.karate.Suite - <<fail>> feature 1 of 2 (1 remaining) classpath:conduitApp/feature/Articles.feature
---------------------------------------------------------
feature: classpath:conduitApp/feature/HomePage.feature
scenarios:  2 | passed:  2 | failed:  0 | time: 4,2049
---------------------------------------------------------

23:32:21.752 [pool-3-thread-1] INFO  com.intuit.karate.Suite - <<pass>> feature 2 of 2 (0 remaining) classpath:conduitApp/feature/HomePage.feature
Karate version: 1.4.1
======================================================
elapsed:   5,49 | threads:    5 | thread time: 5,98 
features:     2 | skipped:    0 | efficiency: 0,22
scenarios:    3 | passed:     2 | failed: 1
======================================================
>>> failed features:
status code was: 422, expected: 201, response time in milliseconds: 486, url: https://api.realworld.io/api/articles, response: 
{"errors":{"title":["must be unique"]}}
classpath:conduitApp/feature/Articles.feature:18
<<<

HTML report: (paste into browser to view) | Karate version: 1.4.1
file:///C:/Users/javie/KarateGit/myproject/target/karate-reports/karate-summary.html
===================================================================

[ERROR] Tests run: 1, Failures: 1, Errors: 0, Skipped: 0, Time elapsed: 6.194 s <<< FAILURE! - in conduitApp.ConduitTest
[ERROR] conduitApp.ConduitTest.testParallel  Time elapsed: 6.162 s  <<< FAILURE!
org.opentest4j.AssertionFailedError: 
status code was: 422, expected: 201, response time in milliseconds: 486, url: https://api.realworld.io/api/articles, response: 
{"errors":{"title":["must be unique"]}}
classpath:conduitApp/feature/Articles.feature:18 ==> expected: <0> but was: <1>
	at org.junit.jupiter.api.AssertionFailureBuilder.build(AssertionFailureBuilder.java:151)
	at org.junit.jupiter.api.AssertionFailureBuilder.buildAndThrow(AssertionFailureBuilder.java:132)
	at org.junit.jupiter.api.AssertEquals.failNotEqual(AssertEquals.java:197)
	at org.junit.jupiter.api.AssertEquals.assertEquals(AssertEquals.java:150)
	at org.junit.jupiter.api.Assertions.assertEquals(Assertions.java:560)
	at conduitApp.ConduitTest.testParallel(ConduitTest.java:15)
	at java.base/jdk.internal.reflect.NativeMethodAccessorImpl.invoke0(Native Method)
	at java.base/jdk.internal.reflect.NativeMethodAccessorImpl.invoke(NativeMethodAccessorImpl.java:64)
	at java.base/jdk.internal.reflect.DelegatingMethodAccessorImpl.invoke(DelegatingMethodAccessorImpl.java:43)
	at java.base/java.lang.reflect.Method.invoke(Method.java:564)
	at org.junit.platform.commons.util.ReflectionUtils.invokeMethod(ReflectionUtils.java:727)
	at org.junit.jupiter.engine.execution.MethodInvocation.proceed(MethodInvocation.java:60)
	at org.junit.jupiter.engine.execution.InvocationInterceptorChain$ValidatingInvocation.proceed(InvocationInterceptorChain.java:131)
	at org.junit.jupiter.engine.extension.TimeoutExtension.intercept(TimeoutExtension.java:156)
	at org.junit.jupiter.engine.extension.TimeoutExtension.interceptTestableMethod(TimeoutExtension.java:147)
	at org.junit.jupiter.engine.extension.TimeoutExtension.interceptTestMethod(TimeoutExtension.java:86)
	at org.junit.jupiter.engine.execution.InterceptingExecutableInvoker$ReflectiveInterceptorCall.lambda$ofVoidMethod$0(InterceptingExecutableInvoker.java:103)
	at org.junit.jupiter.engine.execution.InterceptingExecutableInvoker.lambda$invoke$0(InterceptingExecutableInvoker.java:93)
	at org.junit.jupiter.engine.execution.InvocationInterceptorChain$InterceptedInvocation.proceed(InvocationInterceptorChain.java:106)
	at org.junit.jupiter.engine.execution.InvocationInterceptorChain.proceed(InvocationInterceptorChain.java:64)
	at org.junit.jupiter.engine.execution.InvocationInterceptorChain.chainAndInvoke(InvocationInterceptorChain.java:45)
	at org.junit.jupiter.engine.execution.InvocationInterceptorChain.invoke(InvocationInterceptorChain.java:37)
	at org.junit.jupiter.engine.execution.InterceptingExecutableInvoker.invoke(InterceptingExecutableInvoker.java:92)
	at org.junit.jupiter.engine.execution.InterceptingExecutableInvoker.invoke(InterceptingExecutableInvoker.java:86)
	at org.junit.jupiter.engine.descriptor.TestMethodTestDescriptor.lambda$invokeTestMethod$7(TestMethodTestDescriptor.java:217)
	at org.junit.platform.engine.support.hierarchical.ThrowableCollector.execute(ThrowableCollector.java:73)
	at org.junit.jupiter.engine.descriptor.TestMethodTestDescriptor.invokeTestMethod(TestMethodTestDescriptor.java:213)
	at org.junit.jupiter.engine.descriptor.TestMethodTestDescriptor.execute(TestMethodTestDescriptor.java:138)
	at org.junit.jupiter.engine.descriptor.TestMethodTestDescriptor.execute(TestMethodTestDescriptor.java:68)
	at org.junit.platform.engine.support.hierarchical.NodeTestTask.lambda$executeRecursively$6(NodeTestTask.java:151)
	at org.junit.platform.engine.support.hierarchical.ThrowableCollector.execute(ThrowableCollector.java:73)
	at org.junit.platform.engine.support.hierarchical.NodeTestTask.lambda$executeRecursively$8(NodeTestTask.java:141)
	at org.junit.platform.engine.support.hierarchical.Node.around(Node.java:137)
	at org.junit.platform.engine.support.hierarchical.NodeTestTask.lambda$executeRecursively$9(NodeTestTask.java:139)
	at org.junit.platform.engine.support.hierarchical.ThrowableCollector.execute(ThrowableCollector.java:73)
	at org.junit.platform.engine.support.hierarchical.NodeTestTask.executeRecursively(NodeTestTask.java:138)
	at org.junit.platform.engine.support.hierarchical.NodeTestTask.execute(NodeTestTask.java:95)
	at java.base/java.util.ArrayList.forEach(ArrayList.java:1511)
	at org.junit.platform.engine.support.hierarchical.SameThreadHierarchicalTestExecutorService.invokeAll(SameThreadHierarchicalTestExecutorService.java:41)
	at org.junit.platform.engine.support.hierarchical.NodeTestTask.lambda$executeRecursively$6(NodeTestTask.java:155)
	at org.junit.platform.engine.support.hierarchical.ThrowableCollector.execute(ThrowableCollector.java:73)
	at org.junit.platform.engine.support.hierarchical.NodeTestTask.lambda$executeRecursively$8(NodeTestTask.java:141)
	at org.junit.platform.engine.support.hierarchical.Node.around(Node.java:137)
	at org.junit.platform.engine.support.hierarchical.NodeTestTask.lambda$executeRecursively$9(NodeTestTask.java:139)
	at org.junit.platform.engine.support.hierarchical.ThrowableCollector.execute(ThrowableCollector.java:73)
	at org.junit.platform.engine.support.hierarchical.NodeTestTask.executeRecursively(NodeTestTask.java:138)
	at org.junit.platform.engine.support.hierarchical.NodeTestTask.execute(NodeTestTask.java:95)
	at java.base/java.util.ArrayList.forEach(ArrayList.java:1511)
	at org.junit.platform.engine.support.hierarchical.SameThreadHierarchicalTestExecutorService.invokeAll(SameThreadHierarchicalTestExecutorService.java:41)
	at org.junit.platform.engine.support.hierarchical.NodeTestTask.lambda$executeRecursively$6(NodeTestTask.java:155)
	at org.junit.platform.engine.support.hierarchical.ThrowableCollector.execute(ThrowableCollector.java:73)
	at org.junit.platform.engine.support.hierarchical.NodeTestTask.lambda$executeRecursively$8(NodeTestTask.java:141)
	at org.junit.platform.engine.support.hierarchical.Node.around(Node.java:137)
	at org.junit.platform.engine.support.hierarchical.NodeTestTask.lambda$executeRecursively$9(NodeTestTask.java:139)
	at org.junit.platform.engine.support.hierarchical.ThrowableCollector.execute(ThrowableCollector.java:73)
	at org.junit.platform.engine.support.hierarchical.NodeTestTask.executeRecursively(NodeTestTask.java:138)
	at org.junit.platform.engine.support.hierarchical.NodeTestTask.execute(NodeTestTask.java:95)
	at org.junit.platform.engine.support.hierarchical.SameThreadHierarchicalTestExecutorService.submit(SameThreadHierarchicalTestExecutorService.java:35)
	at org.junit.platform.engine.support.hierarchical.HierarchicalTestExecutor.execute(HierarchicalTestExecutor.java:57)
	at org.junit.platform.engine.support.hierarchical.HierarchicalTestEngine.execute(HierarchicalTestEngine.java:54)
	at org.junit.platform.launcher.core.EngineExecutionOrchestrator.execute(EngineExecutionOrchestrator.java:147)
	at org.junit.platform.launcher.core.EngineExecutionOrchestrator.execute(EngineExecutionOrchestrator.java:127)
	at org.junit.platform.launcher.core.EngineExecutionOrchestrator.execute(EngineExecutionOrchestrator.java:90)
	at org.junit.platform.launcher.core.EngineExecutionOrchestrator.lambda$execute$0(EngineExecutionOrchestrator.java:55)
	at org.junit.platform.launcher.core.EngineExecutionOrchestrator.withInterceptedStreams(EngineExecutionOrchestrator.java:102)
	at org.junit.platform.launcher.core.EngineExecutionOrchestrator.execute(EngineExecutionOrchestrator.java:54)
	at org.junit.platform.launcher.core.DefaultLauncher.execute(DefaultLauncher.java:114)
	at org.junit.platform.launcher.core.DefaultLauncher.execute(DefaultLauncher.java:86)
	at org.junit.platform.launcher.core.DefaultLauncherSession$DelegatingLauncher.execute(DefaultLauncherSession.java:86)
	at org.apache.maven.surefire.junitplatform.LazyLauncher.execute(LazyLauncher.java:50)
	at org.apache.maven.surefire.junitplatform.JUnitPlatformProvider.execute(JUnitPlatformProvider.java:184)
	at org.apache.maven.surefire.junitplatform.JUnitPlatformProvider.invokeAllTests(JUnitPlatformProvider.java:148)
	at org.apache.maven.surefire.junitplatform.JUnitPlatformProvider.invoke(JUnitPlatformProvider.java:122)
	at org.apache.maven.surefire.booter.ForkedBooter.runSuitesInProcess(ForkedBooter.java:385)
	at org.apache.maven.surefire.booter.ForkedBooter.execute(ForkedBooter.java:162)
	at org.apache.maven.surefire.booter.ForkedBooter.run(ForkedBooter.java:507)
	at org.apache.maven.surefire.booter.ForkedBooter.main(ForkedBooter.java:495)

[INFO] 
[INFO] Results:
[INFO] 
[ERROR] Failures: 
[ERROR]   ConduitTest.testParallel:15 status code was: 422, expected: 201, response time in milliseconds: 486, url: https://api.realworld.io/api/articles, response: 
{"errors":{"title":["must be unique"]}}
classpath:conduitApp/feature/Articles.feature:18 ==> expected: <0> but was: <1>
[INFO] 
[ERROR] Tests run: 1, Failures: 1, Errors: 0, Skipped: 0
[INFO] 
[INFO] ------------------------------------------------------------------------
[INFO] BUILD FAILURE
[INFO] ------------------------------------------------------------------------
[INFO] Total time:  12.288 s
[INFO] Finished at: 2023-12-14T23:32:22-03:00
[INFO] ------------------------------------------------------------------------
[ERROR] Failed to execute goal org.apache.maven.plugins:maven-surefire-plugin:3.0.0:test (default-test) on project myproject: There are test failures.
[ERROR] 
[ERROR] Please refer to C:\Users\javie\KarateGit\myproject\target\surefire-reports for the individual test results.
[ERROR] Please refer to dump files (if any exist) [date].dump, [date]-jvmRun[N].dump and [date].dumpstream.
[ERROR] -> [Help 1]
[ERROR] 
[ERROR] To see the full stack trace of the errors, re-run Maven with the -e switch.
[ERROR] Re-run Maven using the -X switch to enable full debug logging.
[ERROR] 
[ERROR] For more information about the errors and possible solutions, please read the following articles:
[ERROR] [Help 1] http://cwiki.apache.org/confluence/display/MAVEN/MojoFailureException
